{
  "schema_id": "groove_profile",
  "schema_version": "v1",
  "profile_id": "gp_vector002",
  "scope": "device_local",
  "created_at_utc": "2026-01-15T12:00:00Z",
  "updated_at_utc": "2026-01-24T09:00:00Z",
  "timing_bias": {
    "mean_offset_ms": 4.0,
    "stddev_ms": 10.0,
    "direction": "behind",
    "confidence": 0.55
  },
  "tempo_stability": {
    "supported_bpm_range": [90, 130],
    "drift_slope": 0.1,
    "fatigue_sensitivity": 0.2,
    "confidence": 0.65
  },
  "subdivision_fidelity": {
    "supported": ["quarter"],
    "unstable": ["eighth", "sixteenth"],
    "swing_tolerance": 0.2,
    "confidence": 0.5
  },
  "error_recovery": {
    "mean_recovery_beats": 1.5,
    "panic_probability": 0.05,
    "self_correction_rate": 0.9
  },
  "groove_elasticity": {
    "microtiming_flex_ms": 35.0,
    "lock_threshold": 0.45,
    "push_pull_balance": "balanced"
  },
  "confidence_band": {
    "lower": 0.55,
    "upper": 0.7
  },
  "evidence_window": {
    "sessions": 4,
    "events": 900
  }
}
